Date,Headline1,Headline2,Headline3,Headline4,Headline5,Headline6,Headline7,Headline8,Headline9,Headline10,Headline11,Headline12,Headline13,Headline14,Headline15,Headline16,Headline17,Headline18,Headline19,Headline20
20220610,"마지막으로 외친 ""전국∼노래자랑""…'유랑공연 70년' 송해 영면(종합)","""연평도 포격도발 北사과 요구""에…尹 ""사과 필요없다, 원점타격""(종합2보)","김여사 ""靑 들어갔으면 안나왔을듯"" 尹대통령 ""안보여주길 잘해""",차기 선호도 이재명 15%·오세훈 10%…한동훈·김동연 첫 진입,"""편히 쉬세요""…'국민 MC' 송해 대구 달성군 처가 선산에 영면","변호사 사무실 방화사건, 변호사 등 피해자 2명 '자상' 흔적",[키이우를 가다] 이정표 뗀 고속도로 곳곳엔 무장군인 검문소,"태국, 中에 '최후통첩'…""잠수함에 두달내로 독일 엔진 넣어야""",대구 변호사사무실 방화 현장서 흉기 발견…2명 '자상' 흔적(종합),차기 선호도 이재명 15%·오세훈 10%…한동훈 '4%' 첫 등장(종합),"마지막으로 외친 ""전국∼노래자랑""…'유랑공연 70년' 송해 영면","尹대통령, '韓정상 최초' 나토 정상회의 참석…""다수 양자회담""(종합)","방화범 천씨, 월세 20만원 살면서 6억8천만원 아파트시행사 투자","""패소 앙심""…방화 용의자, 흰천 덮은 물건 들고 건물 들어갔다(종합)","대구 변호사사무실 빌딩, 방화추정 화재…7명 사망(종합2보)","이창용 ""인플레 확산되면 피해 커져""…기준금리 추가 인상 시사","문 전 대통령, 김영록 전남지사 등 만나 ""민주당 거듭나야""",[영상] K-9에 자리 내준 노르웨이 M109…우크라에 22문 보내,"권성동, 친윤 '민들레' 공개반대…""의도있다면 앞장서서 막겠다""(종합)","권성동, 친윤모임에 ""계파론 나오면 尹정부 성공 방해…막겠다""(종합2보)"
20220611,변호사사무실 방화사건 사망자 모두 일산화탄소 중독사(종합),"'저출생 매우 심각' 남성 74％, 여성 56％…""국가 지원 부족""",'인플레 길어진다' 공포에 뉴욕증시 털썩…다우 880P↓(종합),"이인영 ""이재명·송영길 왜 출마했나…박지현 '86용퇴론' 난감""","김여사 ""靑 들어갔으면 안나왔을듯"" 尹대통령 ""안보여주길 잘해""",대구 변호사사무실 방화 사망자 7명 모두 일산화탄소 중독사,"미군 원숭이두창 첫 감염…美, 백신 50만 도스 추가주문(종합)","촉법소년 연령 하향, 국회에 이미 의원 법안 줄줄이 대기",지구촌 동시다발 덮치는 각종 인플레…한국도 지갑만 얇아진다,"[위클리 건강] 시도 때도 없는 방귀, 건강 이상 신호일까","김정은 ""강대강·정면승부 투쟁""…전원회의서 핵 언급은 없어(종합2보)",[키이우를 가다] 그날 부차에서 학살당한 116명의 원혼,"태국, 中에 '최후통첩'…""잠수함에 두달내로 독일 엔진 넣어야""","우크라, 헤르손서 반격 확대…""5개 정착지 주변 적 진지 공습""","나경원, 尹정부에 ""여성 인선 구색맞추기 안돼…핵심 역할해야""",[OK!제보] 강아지 찾아주면 1천만원…1년간 생업도 포기한 50대,"마지막으로 외친 ""전국∼노래자랑""…'유랑공연 70년' 송해 영면(종합)","독일 연방군 장군 ""독일에 대한 심각한 군사적 위협"" 경고",與 민들레모임에 권성동 제동…계파논쟁 속 분화하는 윤핵관(종합),"장제원, 친윤모임 '민들레' 불참 선언…""성동이 형과 갈등 없다"""
20220612,'이재용 사촌형' 이재관 전 새한그룹 부회장 별세…향년 59세,"바이든 ""젤렌스키, '러시아 침공' 경고 들으려 하지 않아""",15억 집 팔고 20억 집 사는 일시 2주택자 취득·양도세 3.3억↓,"尹부부, 팝콘 먹으며 '브로커' 관람…""시민과 늘 어울리겠다""(종합)","우상호 ""'수박' 쓰면 가만 안둘 것…민형배 복당 요청 안한다""","尹대통령, 국정원장·군경 정보라인 '독대 보고' 안 받는다","이준석, '민들레 불참' 장제원에 ""결단 존중…尹정부 성공 위한 길""","'휴일 공식일정' 尹부부, '브로커' 보고 '칸의 남자들'과 만찬(종합)",[키이우를 가다] 두 동강난 9층 아파트…전란이 남긴 악취 진동,"김건희 여사, 내일 권양숙 여사 만난다…양산行도 추진(종합)","이준석 ""장제원 결단 존중""…정진석엔 ""서열상 당 대표가 위""(종합)",장제원 떠난 與민들레 '잠시 멈춤'…여전한 '세력화' 시선 고민,"'연봉 이내'로 묶인 은행 신용대출, 다음 달부터 풀린다","안철수, 檢편중인사에 ""너무 능력주의 휩싸이면 다양성 힘 간과""","""천사를 먼저 데려가나""…대구 방화 희생자들 오열 속 발인(종합)",[우크라 침공] 세베로도네츠크서 격렬한 시가전…화학공장에 큰불,"브라질, 원숭이두창 확진 2명째 보고…유럽 여행한 20대 남성",1970년대식 스태그플레이션 재연될까…중앙은행 신뢰성이 관건,"포격전으로 전환했지만…우크라 ""탄약 거의 다 썼다""","이준석 ""이제 제대로 자기정치 한번 해보겠다""…90분 작심발언(종합)"
20220613,"월 553만원 이상 소득자, 7월부터 국민연금 1만3천50원 더 낸다","김건희 ""盧, 통합의 대통령 돼라 했을 것"" 권양숙 ""채찍질 참아야""(종합)","尹, 北발사 속 영화관람 지적에 ""미사일 아냐…필요 대응한 것""",오늘부터 손실보전금 확인지급…서류제출 소상공인 23만명 대상,내달 가스요금 또 오른다…10월에는 전기요금과 동반 인상,"'휴일 공식일정' 尹부부, '브로커' 보고 '칸의 남자들'과 만찬(종합)","북한, 서해로 방사포 5발가량 발사…'대적투쟁' 천명후 무력시위(종합)",활동 반경 넓히는 김건희 여사…나토도 동행할까,"김건희 여사, 봉하서 권양숙 여사와 1시간 30분 환담","[키이우를 가다] ""지옥 너머가 있다면 바로 이곳""…이르핀의 상처","대통령실, '北방사포 당일' 尹 영화관람에 ""대응 소홀한것 없다""",1호선 남영역 선로에서 60대 열차에 치여 사망,"인권위, 유치원 '매운 급식' 진정 기각…""인권침해 아냐""",역대 영부인들 만나며 보폭 넓히는 김여사…나토 동행 가능성(종합),"""尹대통령 국정수행, 긍정 48% 부정 44.2%…'긍정' 4.1%p↓""","美 前재무 ""물가 빠른하락 가능성 없어…1~2년내 경기침체 위험""","""내편 들어줘"" 바이든 회유에도…미-러 중간서 꿈쩍 않는 주변국","비트코인, 한때 2만5천달러 밑으로…18개월새 최저",코로나 이후 선거 앞두고 뿌린 추경 94조…초과세수에도 빚늘어,"尹대통령, 김창기 국세청장 금명간 임명…박순애·김승희는 고심"
20220614,국민 20명중 1명 빼곤 코로나19 항체…자연감염 항체 석달새 '0.6%→36%',尹 대통령 자택 앞에서 양산 시위 소리 틀고 '맞불집회',비트코인 16% 내리며 3천만원선 붕괴…1년반 이전 수준으로 회귀,"'김건희 봉하行' 지인 동행 논란…대통령실 ""비공개 일정일뿐""(종합2보)","김건희 ""盧, 통합의 대통령 돼라 했을 것"" 권양숙 ""채찍질 참아야""(종합)","'로또 1등 50명' 설왕설래에…기재부 ""조작 가능성 없다""",오늘부터 손실보전금 확인지급…서류제출 소상공인 23만명 대상,"글로벌 증시 '검은 월요일'…亞·유럽 급락, 美 4% 안팎 폭락(종합)","'무속인 논란' 김여사 동행자는…""선대위·인수위 출신 교수""",미국 부담 눈덩이…우크라 전세변화 탓 변곡점 오나,"美 연준, '자이언트 스텝' 밟나…FOMC 앞두고 설왕설래","민주, 與반발에도 '시행령통제' 국회법 발의…""국회 통제 강화""",수도권 뺀 전국에 비…남해안·제주 강풍,"'구원' 이준석-안철수, 국민의당 몫 최고위원 놓고 충돌 양상(종합)",'자이언트 스텝' 우려에 뉴욕증시 '휘청'…나스닥 4.7% 폭락,"'김건희 봉하行' 지인 동행 논란…대통령실 ""비공개 일정일뿐""(종합)",[키이우를 가다] 일상이 '전쟁'된 주민들…배급소 돌며 끼니 마련,"갤럭시Z플립3, 42만번 접고 펴며 가혹테스트…""여전히 정상작동""","코스피 1년 7개월만에 2,500선 내줬다…장 초반 2,470대(종합)","'97그룹 세대교체론' 부는 野…친명계 ""李 출마 막으려는 포석"""
20220615,"[키이우를 가다] 여군 자원입대 스무살 사샤 ""뭐라도 해야만 했다""","화물연대, 7일만에 파업 철회…국토부와 안전운임제 연장 합의(종합2보)","이재명 ""檢 이용한 정치보복 시작…사법살인 기도 중단하라""(종합)","""충격적 발표""…외신, BTS 단체활동 잠정중단 '초미의 관심'",물갈이 인사·수사권 회복 시도…한동훈 '文정부 뒤집기' 한달,"檢 수사에 민주 ""정치보복"" 집단반발…'잠행' 이재명 전면 등판","한동훈, 차기 대통령 선호도 조사서 이재명·오세훈 이어 3위","尹대통령, 서초동 자택 앞 맞불시위에 ""법에 따른 국민 권리""","'김건희 봉하行' 지인 동행 논란…대통령실 ""비공개 일정일뿐""(종합2보)","우상호 ""文정권에 대한 보복수사 시작…좌시하지 않을 것""","與, 민주 '文정권 보복수사' 발언에 ""문정부 적폐청산도 정치보복인가""",누리호 하늘 향해 기립…발사 준비 순조(종합2보),[이슈 In] 하반기부터 연소득 3천860만원 미만 지역가입자 건보료 준다,尹 대통령 자택 앞에서 양산 시위 소리 틀고 '맞불집회',"대통령 집무실·사저도 '관저'?…경찰 ""용산·서초동은 그렇다""","野 토론회…""文정부 실패한 정부""·""이재명 책임 명백""(종합)","야놀자, 중단했던 '송해 출연' 광고 한시상영…""고인 뜻 따라""",오늘부터 손실보전금 확인지급…서류제출 소상공인 23만명 대상,"뉴욕증시, FOMC 공격적 긴축 우려에 혼조…나스닥 0.18%↑마감",코로나로 아프면 쉴 수 있게…상병수당으로 최저임금 60% 지급
20220616,"김건희 여사, 광폭행보…與중진 부인 오찬에 이순자 예방(종합2보)","美, 금리 0.75%p 인상 '초강수'…내달 또 '자이언트스텝' 가능성(종합2보)","文정부 '월북 피살' 판단 뒤집은 尹정부…""국민생명 최우선""","""北피격 공무원 월북 의도 못찾아""…결론 뒤집은 해경(종합)","[일문일답] 오세훈 ""TBS 기능 쇠해…교통정보 무슨 의미있나""","한동훈, '보복수사' 야당 반발에 ""중대한 범죄 수사""",연준 '자이언트 스텝'에도 뉴욕증시 안도랠리…나스닥 2.5%↑,"푸틴·시진핑, 우크라·양국 협력 논의…""군사 협력 강화도""(종합2보)","'서해피살' 尹정부 뒤집힌 발표에 文측 ""자해행위""…신구권력 충돌","美, 우크라에 곡사포·하푼미사일 등 1조3천억원 무기 추가지원(종합)","美 연준, 기준금리 0.75%p 인상 '초강수'…28년 만에 최대폭(종합)","한미 금리역전 임박…한은, 연내 4회 연속 인상·빅스텝 가능성","""'조선인 싫다' 불지른 日 20대 앞날 걱정했다…그게 우토로""",법인세 최고세율 22%로 인하…1주택자 14억까지 종부세 비과세(종합),"文정부 '월북 피살' 판단 뒤집은 尹정부…""국민생명보다 北눈치""(종합)",연준 '자이언트 스텝'에도 금융시장 안도 랠리…증시↑·유가↓(종합),"재블린 한 방에 날아가는 탱크, 이제 무용지물?…""탱크도 진화""","檢 수사에 민주 ""정치보복"" 집단반발…'잠행' 이재명 전면 등판",누리호 16일 발사 무산…산화제탱크 레벨센서 신호이상 발견(종합3보),"'구미 3세 여아 사망' 다시 재판…대법 ""바꿔치기 의문""(종합)"
20220617,"尹대통령, '정치보복 수사' 지적에 ""민주당 정부땐 안 했나""(종합)","김건희 여사, 광폭행보…與중진 부인 오찬에 이순자 예방(종합2보)","'안도랠리' 하루만에 침체 공포 부활…다우지수, 3만선 붕괴(종합)","피살 공무원 유족 ""월북 프레임 만들려 조작…전 정권 국정농단""(종합)",이재명 겨냥하는 검·경 수사…전대 출마 고민 깊어지는 李,"'서해피살' 尹정부 뒤집힌 발표에 文측 ""자해행위""…신구권력 충돌","뉴욕증시, 다우지수 3만선 붕괴…작년 1월 이후 17개월만","""尹대통령 '잘한다' 49% '못한다' 38%…취임후 50% 밑 처음""","""주유소 갔다 기절할 뻔""…치솟는 유가에 직장인·자영업 비명","서해 피살 공무원 유족 ""기존 수사, 월북 프레임 위해 짜맞춰""","재블린 한 방에 날아가는 탱크, 이제 무용지물?…""탱크도 진화""",Fed '주택구매 만류' 경고대로…美 주담대 금리 13년만에 최고,"尹대통령, '정치보복 수사' 지적에 ""민주당 정부땐 안 했나""",[키이우를 가다] 지하창고서 숨죽여 버틴 '가장 길었던' 2주일,최저임금 업종별 구분 적용 안 한다…예년처럼 '단일 금액'으로(종합2보),메마른 하늘·치솟는 기름값…이중고에 깊어가는 농어민의 한숨,"이준석 ""월북공작 전모 모두 공개돼야…野, 세월호 때처럼 하라""","尹지인 아들, 용산 근무에 野 ""사적채용""…대통령실 ""악의적""(종합)","조국 자산관리인 ""檢, 협조 안 하면 영장 친다 해""…檢 ""황당""","[속보] 尹대통령, '정치보복 수사' 지적에 ""민주당 정부땐 안 했나"""
20220618,마크롱 만난 젤렌스키 '차가운 포옹'…인터넷 밈으로,"러시아 매체, 우크라 참전중 생포된 미국인 2명 영상 공개",[특파원 시선] 대낮 공습경보에도 미동 없는 키이우,"""자이언트 스텝도 부족…美금리 4~7%까지 올려야 물가 잡는다""","김건희 여사, 양산 아닌 서울서 김정숙 여사와 '깜짝회동'(종합)","러 ""우크라군 가담 한국인 4명 사망…모두 13명 참전""","러 ""우크라군 가담 한국인 4명 사망…모두 13명 참전""(종합)","뉴욕증시, 2년여만에 최악 한주…S&P 500 주간 하락률 5.8%","푸틴 ""러 '우크라 군사작전' 세계 경제 위기와 아무런 관련없어""(종합)",유류세 인하폭 30→37% 가닥…L당 57원 추가 인하 효과,"英 유력지 ""BTS 삶은 '신경쇠약 공식'…혹사당하는 백만장자""","주말 도심 곳곳 집회…용산서는 ""돌봄노조 출범"" 행진","與, 연일 서해피격 대야 압박…권성동 ""文 전 대통령 답하라""",'기술·기술·기술' 강조한 이재용…유럽서 본 삼성 초격차 우려,"전현희, 사퇴압박에 ""공직자 임기 법률에 정해져…성실히 수행""(종합)",무기시장도 전쟁…우크라 점찍은 무기 러시아가 싹쓸이,"野 ""'사직강요' 수사하다 이젠 사퇴종용…윤석열식 정의인가""",누리호 2차발사 연기시킨 부품 '1단 산화제탱크 레벨센서 코어',"""누리호 21일 2차 발사 추진…문제 부품 교체 완료""(종합2보)",글로벌 경기침체 우려에 국제유가 추락…서부텍사스유 6.8%↓(종합)
20220619,"바이든, 자전거 타다가 꽈당…""페달 클립에 발이 걸렸다""(종합)",마크롱 만난 젤렌스키 '차가운 포옹'…인터넷 밈으로,"""바다 전망 객실이 100만원""…부산 특급호텔 숙박비 천정부지","비트코인, 1만8천달러로 무너져…공포 투매에 자유 낙하(종합)","임윤찬 ""산에서 피아노 하고만 살고 싶어…아직 배울 것 많아""(종합)",'조용한 내조' 넘어선 김건희…野비판론 뚫고 광폭 이어가나,"러 ""우크라군 가담 한국인 4명 사망…모두 13명 참전""(종합)",文정부 정보공개소송 전수조사 착수…'김정숙옷값'도 항소 취하?,"2년 전 '영끌' 대출자 원리금, 올해 말 30∼40% 불어난다","WP ""우크라 전쟁 장기화…'종전' 없는 남북한처럼 될 수도""","尹대통령 집들이 ""입주 허락 감사…용산을 서울 중심으로""","금융시장 충격에 수도권 주택시장도 '마비'…""살 사람이 없다""",[키이우를 가다] 석달전 사라진 아빠가 주검으로 돌아왔다,"18세 임윤찬, 美반클라이번 피아노콩쿠르 우승…역대 최연소(종합2보)","7월부터 유류세 37% 인하…""전기·가스요금 인상 최소화""(종합3보)",금융위기 후 14년 만에 처음 '대출금리 8%' 시대 온다,"바이든, 자전거 타다가 꽈당…""페달 클립에 발이 걸렸다""","러 ""서방이 우크라에 지원한 소련제 무기, 전장 배치 전 파괴""","""디젤차 괜히 샀나"" 휘발유보다 비싼 경유, 연일 최고가 2천110원대","우상호 ""與도 첩보 보고 '월북이네' 했었다…新색깔론 강력대응""(종합)"
20220620,제주서 시작된 장맛비…23일 전국에 내릴 가능성,"광폭 김건희 여사, 첫 연설까지…""故심정민 소령 대단한 희생""","추경호 ""한전 왜 이 모양됐나…요금 인상 전에 자성 필요""(종합)","[우크라 침공] 러 ""고정밀 공대지 유도무기 305 미사일 사용""","이준석 ""검사에게 삽 쥐여보내 땅 파게 해야 민생인가""",'5만전자' 삼성전자 주가 바닥은 어디?…30% 조정에도 약세,대통령실 코바나 출신 '관저팀'으로 이동할듯…내달 말께 이사,"""尹대통령 국정수행, 긍정 48.0% 부정 45.4%""","우크라 ""세베로도네츠크 인근서 러 공격 격퇴""",2년반 만에 한미 금리 뒤집힌다…과거 역전기 자금 오히려 유입,"푸틴, 카자흐스탄에 ""구소련도 역사적으론 러 일부""…추종 압박","문재인 전 대통령, 게시글 4개 올리며 인스타 활동 재개","누리호, 11시 10분 세워져…발사 준비 순조(종합2보)","美경제학자들 ""1년내 경기침체 확률 44%""…금융위기 때보다 높아","美, 물가안정 위해 중국산 관세 인하·유류세 한시 면제 검토중(종합)","비트코인, 2만달러 선 회복…12일 연속 하락세 '일단 멈춤'","남주혁 측 ""학폭 의혹 사실 아냐…제보자 형사 고소할 것""","국민의힘 윤리위, 모레 저녁 '이준석 징계' 심의(종합)","문재인 전 대통령, 게시글 4개 올리며 인스타 활동 재개","尹대통령 ""지금 국민 숨넘어가는 상황…민생물가 초당적 대응"""
20220621,"국내 독자 개발 '누리호', 오늘 다시 우주로 향한다","치솟는 기름값에 차 두고 지하철로…""러시아워 지나도 붐벼""","[누리호 성공] 한국, 세계 7번째 실용위성 발사 능력 입증","내일부터 만 4세 이상 남자아이, 엄마 따라 여탕 출입 ""안돼요""","전셋값 5%내로 올린 임대인, 실거주 2년 인정…버팀목 한도 확대","김여사 '첫 연설' 광폭행보…천공은 ""영부인 바빠져야"" 영상(종합)","칼뽑아든 尹대통령 ""공공기관 혁신 미룰수 없어…방만경영 개선""","젤렌스키 ""아프리카는 우크라 침공한 러시아의 볼모""","尹대통령 ""공공기관 호화 청사 매각·고연봉 자진 반납해야""","노동계, 내년도 최저임금 1만890원 요구…인상률 18.9%","""파티 끝났다"" 호화청사 철퇴 尹…文정부 '공공부문' 정조준?","뉴욕증시, 하락장 초기단계?…WSJ ""통화정책 방향 틀어야 바닥""","이종호 과기장관 ""누리호 발사 성공…기념비적 순간""(종합)","누리호 목표 고도 700㎞ 도달·위성 분리…""계획 따라 비행""(종합)",누리호 발사 성공…7대 우주강국 반열에(종합2보),"남주혁 측 ""학폭 의혹 사실 아냐…제보자 형사 고소할 것""",[속보] 누리호 3단엔진 정지 확인…목표 고도 700㎞ 도달,누리호 오후 4시 발사 확정…10분 전부터 카운트다운(종합),"내 나이 100살, 꿈 아니다…'백세인' 9가지 필수조건","전셋값 5%내로 올린 임대인, 실거주 2년 인정…버팀목 한도 확대(종합)"
20220622,내일 전국 장마 돌입…'폭우→폭염→폭우' 이어진다,원숭이두창 의심자 인천·부산서 1명씩…1명은 입국 다음날 격리,"'실종 보고' 받은 서욱의 첫 지시 ""월북 가능성 잘 봐야된다""","[특파원 인플레 보고] ②""월마트 패닉""…美에 닥친 '미친 인플레'","尹대통령, 文정부 탈원전 겨냥 ""5년간 바보같은짓…바로잡아야""","국내 첫 원숭이두창 감염 의심자 2명 발생…""진단검사 진행중""(종합2보)","尹국정수행 '긍정' 47.6%, '부정' 47.9%…취임 후 첫 데드크로스","원자력공장서 질문 25개 쏟아낸 尹, 탈원전 ""바보짓"" 직격탄",국내 첫 원숭이두창 감염 의심자 나왔다…인천공항 입국(종합),원숭이두창 국내 첫 확진자 나왔다…독일서 입국한 내국인(종합),"원숭이두창 의심자, 유증상인데도 '증상없음' 신고해 공항 통과",호화청사 기준은 '1인당 면적'…尹지시 하루만에 전수조사,"원숭이두창 의심자 1명 '양성'…질병청, 오후 확진여부 발표",러시아와 400㎞ 떨어진 러시아땅…일촉즉발 칼리닌그라드는,치안감 인사 초유 번복 사태…2시간만에 7명 보직 정정(종합2보),내달부터 가계 대출 확 달라진다…DSR 규제 강화,"한총리 ""한전, 개혁할 부분 많다…민간이었으면 도산했다""","尹대통령 ""탈원전 폭탄에 원전산업 폐허…철철 넘치게 지원""(종합)","美 ""한반도 제외한 모든 지역서 대인지뢰 사용 금지""(종합 2보)",원숭이두창 국내 첫 확진자 나왔다…독일서 입국한 30대 내국인(종합3보)
20220623,"뮤지컬1세대, '친분캐스팅' 논란에 ""배우, 캐스팅 침범 안돼""",이준석-배현진 또 신경전…악수 뿌리치고 '어깨 툭'에 무반응,"격앙된 尹, 치안감 인사 논란에 ""중대 국기문란""…경찰 책임론(종합)","원자력공장서 질문 25개 쏟아낸 尹, 탈원전 ""바보짓"" 직격탄","이준석-배현진, 악수 뿌리치고 어깨 툭…비공개회의서도 입씨름(종합)","러, 우크라 곡물 터미널 폭격…서방 ""세계식량난 부채질"" 비난","옥주현, '친분캐스팅' 논란에 뮤지컬배우 김호영 명예훼손 고소","尹대통령, 치안감 인사 논란에 ""중대한 국기문란…어이없다""",2주 미뤄진 이준석 '운명의 날'…징계 수순 관측 속 與 블랙홀로,"노정객들이 회고한 조순…""의원 멱살 봉변에 선비처럼 대처""",폭락장 못 버티는 빚투 개미들…곧 '역대급' 반대매매 우려도,"""국기문란"" 격노한 尹, 김창룡 겨냥?…정부 진상조사 착수 주목",靑 국민청원 폐지하고 국민제안 신설…20만 동의 없어도 답변,올해 첫 장마로 내일까지 강한 비…호우 대처 중대본 1단계 가동,'한국 경제학 거목' 조순 서울대 명예교수 별세…향년 94세(종합),호화청사 기준은 '1인당 면적'…尹지시 하루만에 전수조사,"'이준석 징계', 내달 7일 소명 듣고 결정한다(종합2보)","흥남철수 마지막 배 美기관사 ""단 한명의 한국인도 울지 않았다""","테라 권도형 ""코인재산 거의 잃었다…과거 발언 후회한다""",수도권·강원지역에 100㎜ 이상 폭우…비 피해 잇따라
20220624,조국에선 '반역자'·서구에선 '공범'…궁지 몰린 오페라의 여왕,폭락장 못 버티는 빚투 개미들…곧 '역대급' 반대매매 우려도,"친분캐스팅 논란에 '엘리자벳' 제작사 ""옥주현 전혀 관여 안해""","""대통령 돕는 정당 맞나"" 장제원 직격에…李 ""드디어 직접쏘나""","옥주현, 김호영 고소 취하키로…'친분캐스팅' 의혹은 거듭 부인","尹대통령, 경찰청장 용퇴론에 ""임기 한 달 남았는데 중요하나""",원숭이두창 첫 확진자도 검역대서 못 걸러…공항로비서 신고(종합2보),"""대통령 돕는 정당 맞나"" 장제원 직격에…李 ""드디어 직접쏘나""(종합)","'폭행·흉기 위협' 정창욱 셰프…피해자들 ""엄벌해달라""","박지현 ""폭력적 팬덤 원조는 극렬 문파…이재명, 고초 겪어"" 엄호","홍영표 ""이재명, 당권 나오지 말라""…李 ""108번뇌하고 있다""","[영상] 푸틴 경고했던 HIMARS 우크라 도착…미국 ""더 보낼 것""","미중, 한국 나토회의 참가 놓고 충돌…美 ""中 거부권 없어"" 비판","""'피격 공무원' 사건 책임""…해경 지휘부 집단사의(종합2보)","[영상] ""오늘까지 30년 걸렸다""…전쟁 중 우크라 국민 활짝 웃은 날","코로나 격리자 생활지원비, 내달 11일부턴 소득하위 절반만 지급","""국기문란"" 격노한 尹, 김창룡 겨냥?…정부 진상조사 착수 주목","野난상토론 ""이재명 전대 나오지 말라"" 李 ""상처만 남을까 고민""","증시 아직 바닥 멀었나…코스피 전망 2,000까지 하향(종합2보)","연쇄살인범 권재찬 1심 사형 선고…""교화 가능성 없어""(종합2보)"
