Date,Headline1,Headline2,Headline3,Headline4,Headline5,Headline6,Headline7,Headline8,Headline9,Headline10,Headline11,Headline12,Headline13,Headline14,Headline15,Headline16,Headline17,Headline18,Headline19,Headline20
20230203,14억이 애태운 中고교생 의문의 실종…극단선택 결론,"[삶] 이수정 교수 ""연쇄살인범 강호순이 사형집행 가능성 물었다""","'깐부 할아버지' 오영수 첫 재판서 ""추행 안 했다""…혐의 부인","조국, 실형 선고에 찡그리며 한숨…""혐의 8~9개는 무죄""(종합)",투신 시도 여성 구조 50분 만에 재투신…경찰 대응 두고 논란,"""승객 30% 이상 줄어"" 껑충 뛴 택시 요금에 늘어난 '빈 차'","혼자 집에 방치돼 숨진 2살 부검…""굶어서 사망했을 가능성""","미국서 퍼지는 '좀비 마약' 펜타닐…""한국도 안전지대 아냐""","""신규확진 ○○○명"" 매일 울리던 재난문자 3년만에 중단","미국 본토 상공 침투해 휘젓고 다닌 中 정찰풍선…""전투기 출격""(종합)",조국 '입시비리·감찰무마' 3년만에 오늘 1심 선고,"불붙은 무임승차 연령 상향…오세훈 ""모든 가능성 열고 논의""","김성태, 800만달러 외 50만달러 추가 北 전달…검찰, 용처 파악","엘살바도르 '여의도 절반' 크기 땅에 거대감옥…""4만명 수용""",[2보] 조국 1심 징역 2년 실형…법정구속은 면해,"국방前대변인 ""관저선정때 천공답사""…경호처 ""전혀 사실아냐""(종합2보)",슈퍼카가 알고보니 회사차…람보르기니 10대 중 8대가 법인차,"대통령실, '천공 의혹' 국방부前대변인·언론사 2곳 기자 고발",청소년도 '프리패스'…'일탈 온상' 지목된 룸카페 가보니,"금융당국 ""애플페이 국내 서비스 가능"""
20230204,"""가셔도 된다"" 응급실 간호사 말에 대뜸 따귀 때린 50대 철창행","""보신탕의 종말""…개고기 대체한 염소 가격 반년새 73％↑",아빠가 딸을…유명 유튜버 '명예살인' 당해 이라크 발칵,무려 영하 77도…미 대륙에 체감온도 신기록,"中, '美 본토 비행' 정찰풍선 ""중국 비행선"" 인정…유감 표명(종합)",청주 대형사우나 시설 불…92명 긴급대피(종합),"신평 ""安 당선 시 尹 탈당할수도"" 이준석 ""당원에 대한 협박""","이재명 ""尹정권에 경고…나는 짓밟아도 민생을 짓밟진 말라""(종합)","2살 아들 혼자 집에 사흘 방치해 숨지게 한 엄마 ""미안하다""",여친 아빠 카드 비번 얘기에 귀 '쫑긋'…돈 빼낸 절도범은 남친,"조국, 실형 선고에 찡그리며 한숨…""혐의 8~9개는 무죄""(종합)","""바이든, 러에 '우크라 영토 20% 줄테니 종전하자' 제안""","장제원 ""윤핵관 지휘자?…安, 대통령 공격 못하니 나를 공격""","""승객 30% 이상 줄어"" 껑충 뛴 택시 요금에 늘어난 '빈 차'","'골든타임은 15분'…공군, 얼음물 속 조난조종사 구조 훈련 실시","이재명 ""평범한 유족을 투사로 만드는 尹정권에 분노""",러에 군수품 대준 튀르키예…전차용 고무·발전기 무더기 수출,"與 ""이재명 지키자고 이성도 양심도 상실"" '野장외투쟁' 맹공(종합)","나경원 자택 찾아간 김기현 ""힘 합치자""…羅 ""역할 숙고""","美, 또다른 中정찰풍선 지목…""중남미 상공 통과 중""(종합)"
20230205,"尹대통령, '윤핵관' 저격 安겨냥 ""국정운영 방해꾼·적"" 언급",무려 영하 77도…미 대륙에 체감온도 신기록,"미국, 중국 '정찰풍선' 격추…숨돌리던 미중갈등 재격화 예고",아빠가 딸을…유명 유튜버 '명예살인' 당해 이라크 발칵,"""중국, 러시아에 군사장비 공급해 우크라 침공 지원""","미국, 동부 해안서 스텔스기로 中풍선 격추…가라앉은 잔해 수거(종합2보)","안철수 ""지금 일들 대통령실 선거개입…정당민주주의 근본 훼손""","불붙은 은행 수수료·금리 인하 경쟁…신한, 창구 이체도 면제(종합)",42년 만에 빙하에 갇혔다 가족 품에 돌아온 아르헨 20세 산악인,대출규제 풀리니 서울 아파트 15억원 초과 거래 늘었다,"""젤렌스키, 새 서방무기로 러 본토 공격 않기로 약속""","미국, 전투기로 中 정찰 풍선 격추…동부 해안서 잔해 수거(종합)","중국, 미국의 '정찰풍선' 격추에 ""강한 불만과 항의 표시""","이재명 ""尹정권에 경고…나는 짓밟아도 민생을 짓밟진 말라""(종합)",안철수가 불지핀 윤핵관 논란…용산까지 나서며 與전대 이전투구,"신평 ""安 당선 시 尹 탈당할수도"" 이준석 ""당원에 대한 협박""","""2020년생 노인될때도 한국 노인빈곤율 최악…10명중 3명 빈곤""","""중국, 러시아에 무기부품·기술 팔아 우크라 침공 지원""(종합2보)","""배 포기해야 했다"" 청보호 선원 증언으로 본 급박했던 10분",이태원 유족·서울시 대치…'대한문 분향소' 갈등 재현되나
20230206,"SM, 이수만 퇴진에 내분…""일방적 발표 반대""vs""체질 개선 필요""","얼굴 공개한 조민 ""난 떳떳…의사 자질 충분하다 들어""","넷플릭스, 칠레서 계정공유 단속했더니…""정상 이용자도 차단""","갈비탕 쏟아 손님 화상…""손님도 잘못"" 주장 음식점 2심도 패소",1억원대 농구교실 운영비 횡령 혐의…강동희 전 감독 기소,"""北 개성에 하루 수십명씩 아사자…김정은, 두차례 간부 파견""","조민 ""의사 자질 충분하다 들어""…정유라 ""웃고 간다""(종합)","[튀르키예 강진] 교민이 전한 참상…""잔해와 먼지 흩날려 앞이 안보일 지경""","""튀르키예 강진에 사망자 급증…시리아까지 200명 육박""(종합)","""육군 간부가 전동드릴로 병사에 가혹 행위""…軍 수사 착수",안철수가 불지핀 윤핵관 논란…용산까지 나서며 與전대 이전투구,지구대서 자던 만취자 넘어져 의식불명…경찰 보호 조치 논란,"[영상] 조국 딸 조민 얼굴 공개…""난 떳떳…의사 자질 충분하다 들어""",튀르키예 규모 7.8 강진 사망자 최소 568명…부상자 수천명(종합2보),"尹대통령, 安 엄중경고 요청…대통령실 ""1호당원 의견개진 당연""","미국, 중국 '정찰풍선' 격추…숨돌리던 미중갈등 재격화 예고","마스크 해제 1주 후에도 확진자는 '뚝'…""안 벗는 사람 많아""",청보호 선실서 실종자 숨진 채 발견…시신 1구 수습(종합),"한동훈, 민주당에 ""차라리 특정인 처벌금지법 만들라""","장제원 ""안철수가 尹대통령 끌어들여…대통령실 당무개입 아냐"""
20230207,[이슈 In] 배우자가 무슨 죄라고…건보 피부양자 동반 탈락 왜?,[튀르키예 강진] 하루 만에 사망자 4천명 넘겨…날씨까지 악재(종합),폭설 갇힌 韓관광객들 구해준 미국인 부부에 한국여행 '선물',[튀르키예 강진] 하루 만에 사망자 4천명 육박…날씨까지 악재,"美 여성, 사망 판정받고 장례식장 갔다가 3시간 만에 '생환'",퇴근길 남산 3호터널 차량 화재…한때 양방향 통제(종합),"조민 ""의사 자질 충분하다 들어""…정유라 ""웃고 간다""(종합)","공군 일병 아파트서 숨진채 발견…가족에 ""부대내 괴롭힘"" 호소","[튀르키예 강진] ""아마겟돈 같았다…지구 최후의 날과 같은 광경""",[속보] 튀르키예 지진 사망 3천672명으로…부상자도 1만6천명 넘어,"[튀르키예 강진] 교민이 전한 참상…""잔해와 먼지 흩날려 앞이 안보일 지경""","알고 보니 日 시계점서 제작…은 공예품, 14년 만에 문화재 말소",[속보] 튀르키예·시리아 지진 사망자 5천명 넘겨,"""서방, 우크라 '남북한식 분단' 시나리오 수용 가능성""",교실서 싸움 말리던 친구 흉기로 찌른 중학생 검찰 송치,"얼굴 공개한 조민 ""난 떳떳…의사 자질 충분하다 들어""","""갈때 곱게 잘 가는게 꿈""…87세에 한글 깨친 칠곡할매시인 영면","나경원, 김기현과 회동…""당 깨지는걸 지켜볼수 없다"" 사실상 지지(종합)","1기 신도시 재건축, 안전진단 면제·용적률 최대 500%(종합)",[튀르키예 강진] 10초만에 건물 '폭삭'…2천년 버틴 고성도 파괴(종합)
20230208,"""아들 혼자 엄마에게 극존칭""…초등생 사망에 이웃 충격",[튀르키예 강진] '망연자실' 숨진 딸 손 못 놓는 父情에 전세계 눈시울,"[튀르키예 강진] '재앙 예감했나' 동물 이상행동…""P파 감지 가능""",'지진 사흘째' 튀르키예·시리아 사망자 1만명 넘어서,"""金 45.3%-安 30.4%"" vs ""安 35.5%-金 31.2%""[與 지지층 여론조사]",서울 버스 탑승거리 10㎞ 넘으면 추가요금…거리비례제 추진,"중국 ""풍선은 중국 것""…격추된 풍선 잔해 소유권 주장","침체했던 예산시장, '백종원 효과'로 전국서 찾는 명소로 탈바꿈",조국·곽상도 '자녀가 받은 돈' 유무죄 갈려…경제적 독립 관건(종합),탄핵안 가결에 정국 급랭…'이재명檢수사·특검' 충돌 격화할 듯,"애플 ""애플페이 한국 출시"" 공식 발표",튀르키예·시리아 강진사망 8천명 넘어…골든타임 필사의 수색(종합2보),12살 초등생 온몸 멍든 채 사망…체포된 친부·계모 학대 부인,"파월 연준의장 ""고용·물가 예상보다 강하면 금리 더 올릴 수도""(종합)",튀르키예 강진 사망자 6천300명 넘어…65개국 구조대 급파(종합2보),"대통령실, 모레 도이치모터스 판결 주시…'김건희 특검' 분수령","독일 국방, 우크라 깜짝방문…""레오파르트1 100대 이상 공급""(종합)",이상민 탄핵안 가결·직무정지…헌정사 첫 국무위원 탄핵소추(종합),"김정은, 딸 김주애와 군 장성 숙소 방문…""절대적인 힘을 키워""(종합)","美, 폭발물처리반 투입해 '中정찰풍선' 잔해 수거…사진 첫 공개"
20230209,"전자발찌 찬 30대, 편의점 직원 살해…발찌 훼손하고 도주",[튀르키예 강진] '콧등밴드' 간호장교도 튀르키예 구호대 포함,멍투성이 숨진 초등생 빈소엔 과자가 덩그러니…친모 오열,"""아내 불륜으로 낳은 아기"" 안 데려간 남편 형사처벌 받나",'지진 사흘째' 튀르키예·시리아 사망자 1만명 넘어서,"[튀르키예 강진 현장] 韓긴급구호대, 2세 여아 부녀 등 3명 추가 구조(종합)",편의점 직원 살해 후 달아난 30대…16살 때부터 강도질 반복,12년만에 최악 참사…지진 사흘째 사망자 1만2천명 육박(종합2보),"젤렌스키 ""러시아 모욕 안 된다던 마크롱, 진짜 바뀌었다""",[튀르키예 강진 현장] 공항·도로에 구조대 행렬…마트선 이불·석탄 구호물품 대란,"""피골 상접한 아들 온몸에 피멍""…학대사망 초등생 친모 한탄","""곽상도가 돈 달래""…녹음된 김만배 육성, 증거 인정 안돼","""김기현 52.6%-안철수 39.3%""…""안철수 45.1%-김기현 38.4%""(종합2보)","[튀르키예 강진] 한국 긴급구호대, 생존자 첫 구조…70대 남성(종합)",12명 태웠다가 9명 잃고 돌아온 '멀쩡한 난파선' 청보호,"경찰, 강남 성형외과 등 압수수색…유아인 '프로포폴 투약' 혐의","김기현 ""나경원과 정치적 동지…함께 힘합치기로 약속""(종합)",탄핵안 가결에 정국 급랭…'이재명檢수사·특검' 충돌 격화할 듯,"[튀르키예 강진 현장] 韓구조대, 폐허 헤치고 구한 부녀…""나왔다"" 감격의 환호성",탄핵소추안 가결에도 '장시간 환담' 이어간 尹…의도된 침묵?
20230210,日 대지진 뛰어넘은 참사…튀르키예 강진 사망자 2만명 넘겨(종합2보),"젤렌스키 없는데…""러, 탱크 2천대·30만 병력으로 동부 총공세""(종합)","젤렌스키 없는데…""러, 우크라 동부 루한스크서 총공세 시작""",젤렌스키 무시하다 영국에 뺏겨…다급한 마크롱 파리 만찬 급조(종합),전자발찌 끊고 달아난 '편의점 살인' 30대 부천서 검거(종합),"병가쓰고 실종된 예천군 공무원, 안동 낙동강서 숨진 채 발견(종합)","'멍투성이' 12살 초등생 학대 사망…친부 ""아내가 다 했다""","하이브, 이수만 손잡고 SM 인수…K팝 공룡 기획사 탄생(종합)","이수만, 하이브와 손잡은 막전막후…경영권 회복도 시도하나",튀르키예 강진 사망자 1만9천명…동일본 대지진 수치 넘겨(종합),"[튀르키예 강진 현장] 韓구조대, 폐허 헤치고 구한 부녀…""나왔다"" 감격의 환호성","""아내 불륜으로 낳은 아기"" 안 데려간 남편 형사처벌 받나","[튀르키예 강진 현장] 한국구호대, 짐도 풀기 전 새벽 답사길에 생명 구했다","[튀르키예 강진] '폐허 속 기적' 신생아에 ""입양하겠다"" 수천명 문의(종합)","[2보] 하이브, SM 전격 인수…이수만 지분 14.8% 매입 1대 주주로","경찰, 유아인 대마 흡입 여부도 수사…감정서 '양성'",도이치 주가조작 1심 유죄…김건희 여사 수사 가능성은,[튀르키예 강진] 또다시 터전 잃은 시리아 난민 …유럽행 재개될까,"[튀르키예 강진] '폐허 속 기적' 신생아에 ""입양하겠다"" 수천명 문의",지진 사망자 2만1천500명 넘어…금세기 7번째 최악 참사
20230211,공룡인형 들고 웃는 영정사진…멍투성이 12살 마지막 배웅길,"러, 우크라 전역 미사일 공습…""몰도바·루마니아 영공 지나가""(종합)","美, 中정찰풍선 격추 6일만에 알래스카 상공서 미확인 물체 격추(종합)",어렵게 낳고도…산후우울증 끝에 아기 살해한 30대 징역형,"""용병 아니라 살인범""…러 '죄수 부대' 귀향에 주민 공포 현실로","이재명 ""윤미향, 얼마나 억울했을까…나조차 의심해 미안""","이재명 '대장동 의혹' 11시간 조사 종료…李 ""부당한 처사""(종합2보)","고작 20만원 뺏으려고…편의점 강도살인 30대 ""죄송하다""","서방, 우크라에 전투기 줄까…""줘도 못쓴다"" 난제 수두룩",뉴욕 한복판서 20대 남성 총격에 사망…관광객 혼비백산,"친이준석계, 김기현·안철수 싸잡아 비판…""탄핵 망상"" ""코미디""","웹툰작가 야옹이, 탈세혐의 조사 시인…""차량 사적사용 안해""",[튀르키예 강진] 생후 10일 아기 구조…골든타임 지나 이어진 '기적'(종합),[튀르키예 강진] 골든타임 지났어도 한줄기 희망…115시간만에 임신부 구조,"檢, 김성태 대북송금 '800만달러+α'·'대가성 여부' 규명 주력","이재명 추가소환 없을듯…검찰, 내주 구속영장 청구 전망","[튀르키예 강진 현장] 피란행렬 엑소더스에 공항 '북새통'…""무작정 탈출한다""","경찰, 유아인 대마 흡입 여부도 수사…감정서 '양성'","[튀르키예 강진] 130개 국제구조팀, 강진현장 투입…구호물자도 잇따라",'80대 노인 운전' 통근버스 언덕 아래로 떨어져…22명 부상
20230212,금리·입주폭탄에 떨어진 서울 전셋값…재계약때 수억원씩 '뚝',연말연초 은행 떠난 2천200여명…1인당 최소 6억∼7억원 챙겼다,[튀르키예 강진 현장] 차량 버리고 계속 뛰다…'폐허 된 전쟁터' 대재앙의 비극,"北 '김주애 백마' 등장…RFA ""주민에 주애 이름 개명하라""",HDC 정몽규 회장 장남 11일 결혼…범현대가 총출동,캐나다 영공서 또 미확인 비행물체…미군 전투기가 격추(종합),평창서 교통사고 화재로 스키동호회 대학생 추정 5명 숨져(종합2보),평창서 승용차 교통사고 뒤 화재…대학생 추정 5명 숨져(종합),지진 사망자 2만5천명 넘겨…골든타임 지나도 '생환 소식' 계속(종합2보),아파트 수영장서 구조된 유아 중태…경찰 조사,'가뭄에 귀한 식수 콸콸' 광주 정수장 고장에 단수(종합),"이재명 ""윤미향, 얼마나 억울했을까…나조차 의심해 미안""",오늘은 택시·내일은 지하철…공공요금발 5% 물가 더 간다,공룡인형 들고 웃는 영정사진…멍투성이 12살 마지막 배웅길,외출자제·예약취소…휴일 난데없는 단수에 광주 대혼란,캐나다 영공서 또 미확인 비행물체…美 F-22기가 격추(종합2보),"최기원, SK주식 담보 대출로 대장동 사업 투자…최태원 ""몰랐다""","친이준석계, 김기현·안철수 싸잡아 비판…""탄핵 망상"" ""코미디""","[튀르키예 강진 현장] 피란행렬 엑소더스에 공항 '북새통'…""무작정 탈출한다""","""챗GPT가 내 업무도 대신?""…직장인들도 '관심'"
20230213,[튀르키예 강진] 배구시합 왔다가 참변…학생선수단 39명 장례식 눈물바다,"[튀르키예 강진] 멕시코 구조견, 임무 수행 중 하늘로…韓 토백이는 부상투혼","[튀르키예 강진] 죽은 딸 손 못 놓은 아버지 ""천사처럼 잠들어""",강아지 둔기로 수십차례 때린 동물카페 업주 구속,40대 폭행한 10대 5명 기소…'날아차기' 초등생은 소년부로,부수입 年 2천만원 넘어 별도 건보료 내는 직장인 55만2천명,"""무슨 노래 듣고 계세요?"" 스케치북 들고 묻자 답했다","北 '김주애 백마' 등장…RFA ""주민에 주애 이름 개명하라""","[튀르키예 강진] ""규모 7.0 이상 여진 또 덮칠 수도"" 美당국 경고",우크라 편에서 싸우는 러시아인들…조국에 총부리 겨눈 까닭은,"[튀르키예 강진] 얼마나 강력했으면…지면 위 끝없는 균열, 협곡 생기기도","동물자유연대 ""소싸움 중단하라…전통문화 아닌 동물학대""",둔촌주공 59·84㎡ 사실상 '완판'…소형 평수 무순위 청약 예정,"양육비 1억2천만원 안준 '나쁜아빠', 명단공개에 뒤늦게 지급","""서로 때려봐""…2살 원생 싸움 부추긴 보육교사들 벌금형","尹대통령 ""고금리 고통 커…'은행 돈잔치' 대책 마련하라""",평창서 교통사고 화재로 스키동아리 대학생 5명 숨져(종합3보),"경찰, '천공 의혹' 관련 남영신 전 육군총장 등 조사","美, 휴런호 상공서 미확인 물체 또 격추…""정찰능력은 없는듯""(종합)","尹 ""고금리로 국민 고통…'은행 돈잔치' 대책 마련하라""(종합2보)"
20230214,"""아끼고 아꼈지만""…1월치 난방비 '폭탄 고지서' 속속 도착","대통령실 ""김여사 2년이상 탈탈 털어…455회 거래 전주도 무죄""(종합)",우크라 편에서 싸우는 러시아인들…조국에 총부리 겨눈 까닭은,[튀르키예 강진] 배구시합 왔다가 참변…학생선수단 39명 장례식 눈물바다,"이수만, SM 경영권 분쟁 질문에 무응답…논란 후 첫 공개석상에(종합)",검찰 '빗썸 관계사 차명거래 의혹' 박민영 참고인 조사,"러, 부흘레다르의 굴욕…우크라 드론에 탱크 수십대 속절없이 파괴","""'푸틴 측근' 용병단 수장 탔던 전투기에 일주일뒤 격추 시도""","친조부모상에만 경조휴가…""남성 중심적 차별""","대통령실 ""김건희 여사 계좌 활용됐다 해서 주가조작 가담 아냐""",이제 기댈 곳은 '진짜 기적'뿐…지진 사망 3만7천명 넘어(종합2보),아르헨티나서 한인 남성이 동포 여성 살해 후 암매장,"이재명, 檢영장청구 가능성에 ""제가 어디 도망간답니까""(종합)","필리핀 ""중국함정이 군물자 보급선에 레이저 쏴 선원 일시 실명""","온몸 멍든채 숨진 초등생 계모 ""아이 밀쳤는데 못 일어나""",다이소 판매 중국산 종이빨대 '기준 부적합' 회수 조치(종합),"최태원, 이혼 관련 온라인 비방 댓글 누리꾼 직접 고소","'친명' 정성호, 정진상·김용에 ""이대로 가면 이재명 대통령""","金 ""나경원 조경태 연대 잘했죠"" 安 ""기대고 얹혀살아 이기겠나""(종합)","이재명, 檢영장청구 가능성에 ""제가 어디 도망간답니까"""
20230215,춘천 실종 초등생 충주서 무사 발견…약취·유인 용의자 체포(종합),미국 탑건 망신살…풍선에 쏜 5억원짜리 미사일 빗나가,[튀르키예 강진] 470㎞ 곡선 따라 찢겨진 국토…지도로 본 단층 파열,'한국인 살인 현장' 아르헨 농가에 한인 36명 집단거주해 와,춘천 실종 초등생 엿새만에 무사발견…'유인용의자' 처벌 불가피(종합2보),"전북도, 논란의 아태마스터스 홍보영상 유튜브서 삭제","홍준표 ""'50억클럽' 특검 주장한 그 야당, 처음으로 예뻐 보여""","美 인플레 둔화세 느려졌다…1월 CPI, 6.4% 올라 전망치 상회(종합)",검찰 '빗썸 관계사 차명거래 의혹' 박민영 참고인 조사,"[튀르키예 강진] '숨은 영웅' 한국 구조견 붕대 투혼, 현지서도 화제","""보일러 안켤수도 없고""…아기 키우는 집 난방비에 '한숨'",[튀르키예 강진] 쩍 갈라진 올리브밭…470㎞ 할퀸 지각 파열 포착(종합),'여자 만나려면 대회 참가?'…전북 아태마스터스 홍보영상 논란,"[2보] 춘천 실종 초등생 충주서 무사 발견…""납치 여부 등 조사""",속초의료원 응급실전문의 연봉 4억대 제시…의료공백 해소 관심,"1㎝ 눈에 포항시내 마비…""15분 걸리던 출근길 2시간 걸려""","[튀르키예 강진] 사망자 4만1천명 넘겨…WHO ""100년 내 유럽 최악 참사""",잔해 속 200시간 버틴 지진 생존자 구조…곳곳서 수색 종료(종합),이사중 싱크대서 2천400만원 발견…전 세입자 3명 중 주인 찾아,[튀르키예 강진] 또다시 기적…212시간만에 잔해 속 77세 생존자 구조
20230216,"[튀르키예 강진] ""고마워 형"" 한국구호대 텐트에 적힌 어색한 한글 인사","""우크라에 육군 97% 쏟아부은 러…전차 전력의 40% 잃었다""",아파트 17층서 지인 밀어 추락사…발뺌한 살인범 징역 15년,"이수만 ""이성수는 착한 조카…마음이 아프다""",은마아파트 3.3㎡당 분양가 7천700만원…분담금 최대 7억원대,거세지는 압박에 은행들 '고립무원'…10조원 내놔도 여론은 싸늘,"나토 ""韓포함 파트너국에 '우크라 지원 숙고' 지속 요청할 것""","이재명 ""희대의 사건, 법치 무너진날…의연히 맞서겠다""(종합)","검찰, 이재명 구속영장…제1야당 대표 헌정사상 최초(종합)","뉴질랜드서 홍수 속 소들, 주인 목소리 따라 500m 헤엄쳐 나와","하이브 ""이수만 SM 프로듀싱 안 한다…CTP는 계약 해소 가능""","북파공작원에 납치돼 남한서 67년…법원 ""국가가 10억 배상""",아버지 차 6개월간 위치추적…결국 살해한 20대 아들 구속기소,진흙탕 싸움 된 SM 인수전…'선생님' 칭호 뗀 처조카의 반격,"""푸틴, 우크라 침공후 장갑열차로 자국내 이동…격추 걱정탓""","전주혜 ""최태원-노소영 이혼소송 판사, 대형로펌행…오해 소지""","예식장 잡기 지친 예비부부들, 깊은 한숨…""이미 내년 예약 중""","이성수 SM 대표 반격…""이수만 역외탈세·부동산 욕심"" 의혹 제기(종합)","美셔먼 ""러, 우크라전쟁 지면 부담 클 것""…러 돕는 北中에 경고(종합)",[튀르키예 강진] 쩍 갈라진 올리브밭…470㎞ 할퀸 지각 파열 포착(종합)
20230217,"""한우가 반값이라니""…하나로마트에 '오픈런' 진풍경","日언론 ""서울서 열린 일왕 생일 기념행사서 일본 국가 첫 연주""","우크라 동부서 ""러 연대 전멸""…대공세 강행에 美 ""너무 한심""","생방송 '펑크' 낸 이준석 ""강행군·심야 방송에 늦잠…죄송""","스타벅스, 아메리카노 2천500원 행사…""1999년 1호점 가격으로""","CNN 간판 아침뉴스 진행자, 헤일리 비판하다 '여성 전성기' 실언","이종섭 ""천공 방문 사실 없다고 근무자에 확인한 결과 보고받아""","""中, 미국 정찰 전 수년간 풍선으로 자국민 감시했다""",美 격추한 건 12달러짜리 동호회 풍선?…산으로 가는 풍선 사태,훈련병 못 던진 수류탄 품고 산화 '고 김범수 대위 추모식',"李체포안 전망은? 민주 ""이탈자는 죄인""…27일 본회의 표결 전망","""푸틴, 우크라 침공후 장갑열차로 자국내 이동…격추 걱정탓""",천연기념물 뿔쇠오리 속속 도착…마라도 길고양이 섬 밖으로,"""가장 똑똑한 사람이 가장 돈 많이 버는 건 아니다""",은마아파트 3.3㎡당 분양가 7천700만원…분담금 최대 7억원대,"SM 이성수, 연임 포기…""대표이사·등기이사 사임하고 백의종군""",튀르키예 하타이주에 또 5.2 여진…놀란 주민들 거리로 뛰쳐나와,"이수만 ""이성수는 착한 조카…마음이 아프다""","이재명, 20쪽 설명자료로 檢영장에 반박…""부당한 정치적 목적""","하이브 CEO ""SM 역외탈세, 결코 일어날 수 없는 시나리오"""
