Date,Headline1,Headline2,Headline3,Headline4,Headline5,Headline6,Headline7,Headline8,Headline9,Headline10,Headline11,Headline12,Headline13,Headline14,Headline15,Headline16,Headline17,Headline18,Headline19,Headline20
20210729,"""장난으로 밀었는데""…물놀이하던 20대 헬스 트레이너 익사","[올림픽] ""너랑 헤어진 걸 후회해""…메달 딴 후 날아온 전 여친의 고백","[올림픽] '동양인도 할 수 있다' 보여준 황선우 ""후련합니다""","[올림픽] 강백호, 축구 세리머니로 화답할까…김경문 ""놀랄 정도로 성장""","-올림픽- 황선우, 자유형 100ｍ 결승서 5위…아시아인 69년만의 최고성적",-올림픽-'허광희 일냈다!' 배드민턴 세계 1위 꺾고 8강 직행,"""이재용 8·15 가석방, 찬성 70%…전직 대통령 특사는 반대 56%""","정부 ""현 시점서 '전국 4단계'는 비합리적…3단계 효과부터 분석""","-올림픽- 여자 유도 78㎏ 윤현지, 깜짝 준결승 진출…세계 5위 눌렀다","[올림픽] 코로나, 개인전 탈락, 그리고 금메달…오상욱의 '해피엔딩'","교사가 고교 화장실서 116명 불법촬영…서울교육청, 뒤늦게 퇴출(종합)","윤석열 ""국민의힘 입당한 상태로 대선 출마하겠다""","부동산 전쟁서 코너 몰린 정부, '최후의 화살' 3발 쏜다","-올림픽- 안산, 개인전 16강 안착…韓양궁사 첫 3관왕 도전(종합)",모더나 백신 내주부터 다시 도입…50대 접종 일정대로 진행,"-올림픽- 오진혁, 개인전 첫판 승리…9년만의 금메달 도전 순조","-올림픽- 거침없는 안세영, 배드민턴 8강 진출…천위페이 나와라","화이자 ""백신 부스터샷·경구용 코로나 치료제 임상시험 착수""","[올림픽] 막판 공 돌리기에 화난 이강인…김학범 ""부상 우려 있었다""","尹캠프 ""김건희 접대부·불륜설 단연코 사실 아냐"""
20210730,"[올림픽] 끝내 눈물 삼킨 '에이스'…""파리에선 다시 강한 강채영으로""","주병진, 사우나서 시비 중 40대 폭행…검찰 송치",'배드민턴 천재' 안세영 '일인자' 천웨페이와 8강 격돌,"-올림픽- 요트 하지민, 역사 새로 썼다…최초 메달 레이스 진출","""카카오 김범수, 이재용 제치고 한국 최고부자 등극""<블룸버그>","[올림픽] ""너랑 헤어진 걸 후회해""…메달 딴 후 날아온 전 여친의 고백","[올림픽] 안산 ""'페미니스트 이슈' 알고 있었다…집중하려고 노력""","-올림픽- 높이뛰기 우상혁, 9위로 결선행…한국 육상 25년 만의 쾌거(종합)",18~49세 내달 26일부터 화이자-모더나 접종…9~18일 10부제 사전예약,"[올림픽] 호주 카누 선수, 카약 앞에 콘돔 씌우고 금메달 레이스","[인터뷰] 윤석열 ""누구에게 보복, 있을 수 없는 얘기""",경기 졌다고 10대 제자들 폭행한 유소년 축구팀 감독 집행유예,"-올림픽- 체조 이윤서, 개인종합서 역대 한국 최고 순위 타이 21위","-올림픽- 높이뛰기 우상혁, 결선 진출…한국 육상 25년만의 쾌거",코로나백신 공급 늦어지는데…노바백스 백신 국내 허가 '안갯속',18~49세 내달 26일부터 화이자-모더나 접종…9~18일 10부제 예약(종합),남양유업 홍원식 매각 변심?…돌연 주총 연기·'노쇼' 논란(종합),"-올림픽- 양궁 안산, 개인전 준결승 진출…첫 3관왕까지 '-2승'(종합)","[올림픽] '논란 씻은 3타점' 오지환 ""오직 대표팀 승리만 생각""","-올림픽- 오지환 맹활약…한국 야구, 이스라엘에 힘겨운 연장전 승리(종합)"
20210731,"'관람객 4명 사망' 뉴욕 명물 베슬, 영구 폐쇄도 검토",대한민국 구기 힘내라…오늘 저녁 야구·배구·축구 차례로 출격,"-올림픽- 조코비치, 테니스 단식 동메달 결정전에서도 패배","하루에 중국산 백신 2번 맞은 인니 남성, 코로나19 확진 후 사망(종합)","-올림픽- 한국 야구, 미국에 패해 조 2위…1일 도미니카共과 격돌","-올림픽- 한국 야구, 미국에 2-4 역전패…1일 도미니카共과 격돌(종합)","하루에 백신 2번 맞은 인니 남성, 코로나19 확진 후 사망","20대 확진자 1명 어제 사망…""확진후 오랜 치료, 기저질환 보유""",-올림픽- '9발 모두 10점' 김우진 8강행…'전 종목 석권 보인다',"[올림픽] 8강서 좌절 김학범 ""6실점 실감 안나…제 능력 부족""",8월부터 접종속도 빨라진다…모더나 백신 들어오고 18~49세 접종 시작,진도서 남·여 중학생 2명 아파트서 추락사,"[올림픽] 또 '절반 성공' 그쳤지만…김우진 ""어떻게 해피엔딩만 있겠어요""","[올림픽] ""훔친 메달"" 중국 누른 日선수 비방…번역기까지 동원","-올림픽- 펜싱 여자 사브르, 러시아에 막혀 결승 불발…동메달 결정전으로",[올림픽] 노출 유니폼이 더 편한 선수도 있다…중요한 것은 자율성,"[올림픽] 울어버린 이동준 ""3년을 준비했는데…못 보여드렸다""","""델타 변이, 수두만큼 전염성 강하고 더 심각한 질환 유발""","이스라엘, 세계 첫 코로나19 백신 '부스터샷' 접종 개시","""수학여행 갔다가 20년째 종적 감춘 지적장애 아들 찾아야 해요"""
20210801,"'종식은 없다'…영국 과학자들 ""코로나로 매년 수천명 사망""","[올림픽] 눈물 흘린 여서정에 아빠 여홍철, 미소 보내며 ""동메달!""(종합)","""전 세계 백신 접종 지연에 델타 이어 치명적 새 변이 우려""","한국 육상 역사 새로 쓴 우상혁, 결선서 日 도베와 자존심 대결","드라이기로 몸 말렸다가 ""불쾌하다"" 시비…폭행죄로 법정까지",[올림픽] '14억의 최애' 여자배구팀 탈락에 대륙 탄식,"진중권 ""국힘은 남근의힘?"" 이준석 ""적당히 좀 해요""","[올림픽] 8강서 좌절 김학범 ""6실점 실감 안나…제 능력 부족""","'다주택 논란' 김현아 자진사퇴 ""국민께 죄송""(종합)","[올림픽] 울어버린 이동준 ""3년을 준비했는데…못 보여드렸다""","""재난지원금 100% 지급 반대"" 경기도 시장 7명 긴급회의","-올림픽- '2ｍ35' 우상혁, 한국新 세우며 육상 트랙&필드 사상 최고 '4위'(종합)","-올림픽- 우상혁, 남자 높이뛰기 한국신기록…2ｍ35","하루에 중국산 백신 2번 맞은 인니 남성, 코로나19 확진 후 사망(종합)",[올림픽] 한일전 승리에 코트로 뛰어든 라바리니…'원팀' 완전히 뭉쳤다,"비트코인, 10일 연속 가격 상승…8년 만에 최장 기록",오늘 1천500명 아래…금주 지속 확산땐 수도권 4단계+α 연장 불가피,"-올림픽- 박정아가 만든 5세트 기적…여자배구, 일본 꺾고 8강 확정(종합)","-올림픽- 한국 여자농구, 세계 8위 세르비아에 4점 차 분패",-올림픽- 여서정 도마 동메달…한국 최초 '부녀' 메달리스트 새 역사(종합)
20210802,"-올림픽- 여자배구, 조별리그 세르비아전서 0-3 패배…3위로 8강 진출","[올림픽] 도쿄서 일낸 '일병' 우상혁…""다음 올림픽 목표요? 우승이죠!""","-올림픽- 신재환, 도마서 깜짝 금메달…양학선 이후 한국 체조 두 번째","국민지원금, 편의점 쓸 수 있고 온라인몰·백화점 안 된다",전국이 초비상인데…방역 전선 뒤흔드는 '일탈' 곳곳에서 속출,밤 11시 단속반에게 접근한 호객꾼 따라갔더니 룸마다 술판,"-올림픽- 한국야구, 준결승 진출…이스라엘 11-1, 7회 콜드게임승(종합)","-올림픽- 신재환, 도마서 깜짝 금메달…양학선 이후 한국 체조 두 번째(종합2보)","싸이월드 ""사진·동영상·글 복구 완료""…오늘 오후 로그인 가능","'종식은 없다'…영국 과학자들 ""코로나로 매년 수천명 사망""","-올림픽- 한국 여자농구, 세계 8위 세르비아에 4점 차 분패","[올림픽] 전주원 감독·박지수 ""자신감 얻었다…여자농구 변화의 시작""","회의 도중 바이든에 급히 전달된 메모지…""턱에 뭐가 묻었어요""",'백신 맞았는데도 확진'…美병원 2곳서 무더기로 돌파감염,경기도 '100% 재난지원금' 파장…이낙연·정세균 강력반발,"정부 ""화이자-모더나 백신 가격 인상, 내년도 계약에 영향 줄듯""","""日, 올림픽 급식센터 '풍평피해' 이유로 韓에 대응 요청""(종합)","윤석열 ""대선 출마, 개인적으로 불행…패가망신하는 길""","""전방에 인원 배치하고 사격""…해병대 ""대대장 서면경고""",오후 6시까지 전국서 887명 확진…중간집계 13일만에 1천명 아래
20210803,"[올림픽] 미련 버린 '태권 스타' 이대훈 ""패해서 은퇴하는게 아닙니다""","[올림픽] 레슬링 맏형 류한수, 1분 40초 동안 눈물만 흘렸다",오늘부터 18∼49세 지자체 우선접종 사전예약…접종은 17일부터,"[올림픽] 김연경의 한국 배구, 최초로 아시아 국가 중 유일하게 8강 생존",-올림픽- 류한수 16강 탈락확정…한국 레슬링 반세기 만에 노메달(종합),"올해 대체공휴일, 8월16일·10월4일·10월11일로 확정",책장 뒤 문 열자 비밀공간에 남녀 11명 다닥다닥 숨어,방호복 입고 할머니와 화투 사진 주인공은 삼육서울병원 간호사,"[올림픽] 중국 배드민턴 선수 욕설 논란…대한배드민턴협회 ""공식 항의""","빌 게이츠 부부, 공식 이혼…175조원 재산 분할 계약 동의","[올림픽] 초등 2년 꿈 이룬 여서정 ""아빠에게 뭔가 이뤄드리고 싶었어요""","""가난해 대리비 아끼려 음주운전"" 이재명 대변인 사퇴(종합)","-올림픽- 빛바랜 신유빈의 불꽃타…여자탁구, 독일에 역전패해 8강 탈락","""10시간 차 타고 왔어요"" 태국 한인들 코로나 백신 단체 접종",국민 84% 수도권 4단계 연장 찬성…미접종자 접종의향 비율도 84%(종합),"-올림픽- 다이빙 우하람, 3ｍ 스프링보드 4위…'역대 최고 성적'","[올림픽] 다이빙 최고 성적 우하람 ""4위도 기쁘지만 만족하지 않겠다""","크래프톤 청약 흥행 '참패'…증거금 5조, 경쟁률 7.8대 1(종합)","오후 6시까지 1천425명, 어제보다 538명↑…휴일영향 사라지며 급증","-올림픽- 신재환, 도마서 깜짝 금메달…양학선 이후 한국 체조 두 번째(종합2보)"
20210804,"[올림픽] 목소리 갈라진 김연경 ""오늘이 마지막인 줄…한 시간 잤다""","[올림픽] 굵은 눈물 흘린 터키 선수들 ""한국 배구, 4강 자격 있어""","-올림픽- 한국 여자배구, 5세트 극적 승리…터키 꺾고 4강행","[올림픽] 목소리 갈라진 김연경 ""오늘이 마지막인 줄…한 시간 잤다""(종합)","""윤석열 34% 이재명 25% 이낙연 15%…尹, 양자대결도 우세""","[올림픽] '펑펑' 울어버린 이혜진…""사이클이 관심받을 기회인데""","올림픽 2연패 도전하는 야구 대표팀, 4강서 일본과 '정면충돌'","[올림픽] '캡틴' 김연경, 심판 판정에 항의하다가 경고받아","주병진 폭행 피해자, 고소 취하…""만나 사과받았다""",치솟는 물가·천장 뚫린 집값 …금리인상 '외통수'에 몰린 한은,"-올림픽- '김연경 28점' 한국, 9년 만에 4강행…45년 만의 메달 도전(종합)","尹 ""내 반려견은 180도 '쩍벌' 가능""…또 셀프 디스","[인터뷰] 장성민 ""윤석열은 정치 모르는 아마추어…바로 판 흔들릴 것""","다시 1천700명대, 델타플러스 새 변수…수도권 4단계 연장 가능성","-올림픽- 서채현, 스포츠클라이밍 중간 10위…잠시 후 주종목서 결선 도전",[올림픽] 김연경 '항의도 전략'…팀 사기 올리고·심판 압박하고,"송영길 ""개성공단에 맥도날드 열자…北 제2의베트남으로""","선넘은 與양강…이낙연은 김부선, 이재명은 최성해 소환",내년도 백신도입 협상 마무리 단계…화이자·모더나 5천만회분(종합),"[올림픽] 라바리니 여자배구 감독 ""꿈꾸는 듯…깨고 싶지 않아"""
20210805,"김연경의 여자배구, 브라질과 4강 격돌 '45년 만에 메달 도전'","금메달 도전 야구 대표팀, 미국과 준결승…이기면 일본과 재대결","[올림픽] '목소리 갈라진' 김연경 ""내일 목에 피가 나도록 뛰겠다""",네이비실 퇴출에 앙심 품었나…1조원 美군함 방화범은 20살 수병,"이정훈 강동구청장, 아내 폭행 혐의로 경찰 입건","9호 태풍 '루핏' 우리나라 영향 줄까…""남쪽 해상 높은 파도""","[올림픽] 고진영 ""넬리에겐 지고 싶지 않아…6타 차도 해볼 만""","-올림픽- 고진영, 2R 6타차 6위…한국 여자골프 2연패 '가물가물'","-올림픽- 여자 근대5종 김세희, 펜싱 랭킹라운드 2위 '기염'…김선우 14위","수도권 4단계 연장될듯…정부 ""내일 거리두기 조정, 미비점 보완수준""","[올림픽] 김연경 앞세운 여자배구, 브라질전 필승 전략은 '서브'","이젠 '조폭 사진'까지…명-낙, 막장 폭로전","[올림픽] 무너진 방역…""선수촌 날마다 술판, 밤엔 무법지대""","이재명, 범죄·수사경력 증명서 공개…""음주운전 1건""",카카오뱅크 내일 상장…고평가 논란속 주가 향방 주목,"니카라과, 미인대회 출신 야당 부통령 후보 가택연금","문대통령 ""2025년까지 글로벌 백신생산 5대강국 도약""(종합)","""고양이 학대·언니가 맞아요""…SNS 타고 번지는 오인신고 골치",[올림픽] 투수 5명이 5실점…금메달 꿈 깨트린 '악몽의 6회',"-올림픽- 열여덟 서채현, 스포츠클라이밍 결선진출…6일 메달 도전(종합)"
20210806,"[올림픽] 女배구 4강 상대 브라질 공격수, 도핑 적발로 출전 불발","[올림픽] 아마추어에게 맥못추는 프로복싱, 힘겹게 첫 금메달","""이재명 25%, 윤석열 19%…尹 서울 지지율 급락""",수도권 4단계·비수도권 3단계 거리두기 2주 연장(종합),[2보] 수도권 4단계·비수도권 3단계 거리두기 2주 연장,직계가족 모임 3단계선 4명까지…대면 종교활동 4단계 최대 99명까지,"[속보] 서채현, 스포츠클라이밍 결선 스피드 8명 중 8위","[올림픽] 2연패 어려워진 박인비 ""저 자신에게도 많이 실망""","-올림픽- 일본, 아시아 국가로 29년 만에 여자농구 결승 진출",수도권 오후 6시 이후 3인금지 22일까지 연장…비수도권은 4인까지(종합),"[올림픽] IOC 브리핑 통역 조주연 씨 ""한국어는 고정…양궁·컬링 인상적""",24년전 서울서 사라진 20대여성…남자친구의 때늦은 '살인 자백'(종합),'백신접종 후 사지마비' 40대 간호조무사 산재 인정…첫 사례(종합),"30대 보육교사 백신 접종 하루 뒤 숨져…""인과성 조사중""","[올림픽] '선수 홀대' 대만, 사상 최고성적에 에스코트·포상잔치",거리두기 2주 또 연장…수도권·비수도권에 적용되는 방역수칙은,"김연경과 투혼의 여자 배구, 오늘 밤 9시 '삼바 배구' 넘는다",24년전 서울서 실종된 20대여성…남자친구의 뒤늦은 '살인 자백',"-올림픽- 박희준, 가라테 가타 동메달 결정전 진출…19시40분 3·4위전(종합)","[올림픽] 여자배구, 석연찮은 심판 판정…엉뚱한 플레이에 비디오판독"
20210807,[올림픽] '말 좀 들어줘'…점프 거부한 말에 눈물 쏟은 근대5종 슐로이,"[올림픽] 여자배구, 세르비아전 앞두고 훈련 대신 '꿀맛 휴식'으로 충전",[올림픽] 대회마다 주목받는 '메달리스트 병역특례'…김제덕 등 3명 대상(종합),[올림픽] '우물 안 개구리'로 전락한 한국 야구의 초라한 퇴장,"""코로나 규제 스트레스""…인니 여성, 비키니 시위로 수사","[올림픽] 무너진 '끝판대장' 오승환 ""어떤 말을 해야 할지 모르겠다""",새벽에 알몸으로 여성 사는 2층집 창문 두드린 20대 검거,-올림픽- '고진영·김세영 공동 9위' 여자골프 메달 실패…금메달은 코다,日 도쿄 운행 전동차 내 무차별 흉기 난동으로 9명 부상,24년전 서울서 사라진 20대여성…남자친구의 때늦은 '살인 자백'(종합),"중국 누리꾼 2천500만명, ""미군 실험실 조사하라"" 청원","[올림픽] 근대5종 첫 메달 따낸 전웅태 ""이제 '은'과 '금'이 남았네요""","모레부터 18∼49세 접종 사전예약…""생일 끝자리 날짜 기억하세요""","도쿄 전동차 흉기난동 범인 ""행복해 보이는 여성 노렸다""(종합)","[올림픽] '도핑 적발' 브라질 배구 카이세타 ""고의로 약물 먹지 않았다""","케냐 태생 귀화 한국인 오주한·심종섭, 8일 남자 마라톤 출발",[올림픽] 대회마다 주목받는 '메달리스트 병역특례'…종목 따라 갑론을박,"[올림픽] 다이빙 우하람 ""4위로 끝내지만…메달 딸 때까지 도전은 계속""",태풍 '루핏' 빠르게 북동진 중…내일과 모레 경상권에 많은 비,-올림픽- 믿었던 야구·여자골프 나란히 '노메달'…마라톤 최경선 34위
20210808,"[올림픽] '배구여제' 김연경, 국가대표 은퇴 선언…16년간 에이스로 활약","[올림픽] 라바리니 감독 ""김연경, 그가 얼마나 대단한지 깨달았다""","[올림픽] '여제' 김연경의 품격…세르비아 축하하고, 한국 동료 위로하고","[올림픽] 울컥한 김연경 ""오늘이 국가대표로 뛴 마지막 날""(종합)","-올림픽- 킵초게, 남자 마라톤 2연패…심종섭 49위·오주한 기권(종합)","[올림픽] 김경문 감독 ""강백호, 선배·지도자들이 가르치고 주의줘야""","[올림픽] 강백호 태도에 레전드 박찬호 쓴소리, 일본 언론도 비아냥","[올림픽] '넘어졌어도 다시 달린' 최경선 ""꼭 완주해야 한다는 생각에…""","소프라노 조수미 모친상…""코로나19로 조문 사양""","-올림픽- '마우콩 결승골' 브라질, 남자축구 2연패…스페인 2-1로 제압","-올림픽- 오주한, 15㎞ 지점 앞두고 허벅지 통증으로 기권","-올림픽- 투혼의 여자배구, 세르비아에 막혀 45년 만의 메달 좌절(종합)","-올림픽- 미국, 중국 제치고 3회 연속 종합 1위…한국은 16위",태풍 '루핏' 일본 해상서 북동진 중…동해안에 최대 250㎜ 폭우(종합),도심 한복판 '37 vs 26 난투극' 가담 외국인 2명 항소심 감형,"[올림픽] '몬트리올 동메달 주역' 조혜정 감독 ""연경아, 존경한다""","부산 4단계 격상…""확진자 급증, 의료시스템 붕괴 위기""(종합2보)",부산 10일부터 거리두기 4단계 격상…해수욕장 모두 폐쇄(종합),태풍 '루핏' 영향에 내일까지 동해안에 최대 200mm 비와 강풍 예상,"오늘 1천700명대, 주말 최다…내일부터 비수도권도 가족모임 4명까지"
20210809,"""내 딸도, 내 아들도 아닌 것 같다""…친자 의심이 불러온 '비극'",오후 8시부터 18∼49세 사전예약…오늘은 생일 끝자리 '9' 대상자,"[올림픽] 김응용 회장 ""한국야구 정신 차려야…어린이들도 그렇게 안해""",모더나 8월 공급량 절반 이하로…16일 2차접종부터 접종간격 6주로,"중국 동물원서 관람객끼리 집단 몸싸움…""동물이 사람 구경""","[올림픽] 배구협회장 ""김연경의 헌신 고마워…대표팀 문제는 만나서 대화""",오바마 환갑잔치 사진 유출됐다 삭제…'노마스크 댄스' 모습도,"이재용, 재수감 207일만에 가석방…""경제상황 고려""(종합)",혼자 집에 둔 3살 딸 사망…시신 발견하고도 도망친 엄마,9월부터 3단계까지 전면등교…4단계서도 최대 2/3까지 등교 허용(종합),"[올림픽] 프랑스 마라토너의 비양심, 물병 다 쓰러뜨리고 자기 것만 '쏙'",온라인서 중고 김치냉장고 샀더니 현금 1억1천만원 '횡재'(종합),"교육부, 2학기 전면등교 여부 오늘 발표…4단계서도 등교할까",러시아서 한사람이 1천500명 감염시킨 슈퍼전파 사례 확인,"""'간첩 혐의' 청주 활동가들, 지역신문 통해 北에 보고""",엘리베이터에서 목까지 차오른 물…미 홍수 절체절명의 순간,모더나 8월 공급량 절반 이하로…16일 2차접종부터 접종간격 6주로(종합),루핏 북상에 부산 초속 20ｍ 비바람…도로 잠기고 간판 흔들려,광주고검서 40대 남성이 일본도 휘둘러…검찰공무원 중상(종합2보),"[올림픽] 한국 선수단, 출국 전 올림픽 선수촌서 해단식"
20210810,로또의 비극…23억 당첨 아내와 딸 살해후 극단선택한 미 남성,"말레이 여가수, 임신 7개월째 코로나 감염…응급출산 후 사망",모더나 접종 후 혈전증 검사 거부한 질병청…20대 끝내 숨져,'프로포폴 투약' 하정우 혐의 인정…檢 벌금 1천만원 구형,"서울 절반 면적 불탄 그리스 에비아섬…""하루하루가 공포""(종합)","프랑스 낭트 대성당 방화범, 돌봐주던 가톨릭 신부 살해(종합)","경찰, 트로트 가수 김호중 폭행 혐의 내사 종결",오후 8시부터 18∼49세 사전예약…오늘은 생일 끝자리 '9' 대상자,"""모더나, 화이자 백신보다 델타 바이러스에 더 효과적""","SK바이오 코로나백신 임상 3상 돌입…""내년 상반기 출시 목표""(종합)","""내 딸도, 내 아들도 아닌 것 같다""…친자 의심이 불러온 '비극'",성남 삼성전자 서비스센터서 '칼부림'…수리기사 1명 부상,"""한국 친구 감사합니다"" '김연경 묘목' 선물에 터키단체 감사 글","세월호 특검 ""자료조작 의혹, 증거 없어""…불기소 결론","백신접종 예약 시스템 '순항'…""병목현상 90% 이상 개선""",가석방 이재용 여전히 사면초가…재판·TSMC·인텔에 겹겹 포위,"싱가포르 ""코로나 백신 예약 안 해도 돼요…그냥 와서 맞으세요""","제주도, 모더나 접종자 혈전증 검사 3차례 요구 질병청이 거부",풀려나는 이재용…삼성전자 대규모 투자·M&A 속도내나(종합2보),"주시애틀 총영사, 부임 반년 만에 직무정지"
20210811,카메룬서 트랜스젠더 여성 둘 발가벗기고 30분 몰매,"얼마나 잡히기 싫었으면…""미얀마 청년들 건물서 뛰어내려 숨져""","뉴질랜드 대박난 호떡집 한인 사장 ""가족이 뭉쳐 이뤄낸 성과""","""성폭행 11분밖에 안 된다""며 가해자 형량 감경해준 스위스 판사","한국기관 근무 아프간인 수백명 ""탈레반이 쫓고 있다. 도와달라""",최악 시나리오 현실화하나…확진자 2천명 돌파에 전국 초비상,"정부 ""코로나19 신규 확진 2천200명 넘어…최초 발병 이후 처음""",40대이하 생일 끝자리 '1' 접종예약…내일부터 60~74세 AZ 2차접종,"오늘 2천200명 안팎, 첫 2천명대 '비상'…급확산세에 더 늘어날듯",사나운 까치 공격에 호주 엄마 품속 5개월 아기 참변,"조국 ""정경심 징역 4년…가족으로 고통스러워""","[확진자 2천명대] 4차 대유행 정점은…""앞으로 더 늘어난다""","[속보] 법원 ""정경심 딸 서울대 인턴확인서는 허위""","""현직 판사가 7명 술자리서 성추행""…수사 착수",혈소판 수 이미 기준 이하였는데…궁색한 질병청 검사거부 이유,"[2보] 정경심 2심도 징역 4년…""입시비리 전부 유죄""","정경심 2심도 징역 4년…""입시제도 공정성 훼손""(종합)","밀면-김밥 전문점 식중독 달걀 때문인 듯…""달걀 만지고 손 꼭 씻어야""","영국 전문가 ""델타 변이 때문에 집단면역 불가능""",[확진자 2천명대] 집단면역 차질 빚나…국민 70% 맞아도 안심 못해
